{
  "openapi": "3.0.0",
  "info": {
    "title": "API",
    "version": "1.0"
  },
  "paths": {
    "/health": {
      "get": {
        "operationId": "AppController_health",
        "summary": "App 健康狀態檢查",
        "responses": {
          "200": {
            "description": "",
            "content": {
              "application/json": {
                "schema": {
                  "$ref": "#/components/schemas/ApiResponseDto"
                }
              }
            }
          }
        }
      }
    },
    "/metrics": {
      "get": {
        "operationId": "MetricsController_index",
        "summary": "取得 Prometheus 指標",
        "responses": {
          "200": {
            "description": "",
            "content": {
              "text/plain": {
                "schema": {
                  "type": "string"
                }
              }
            }
          }
        }
      }
    }
  },
  "components": {
    "schemas": {
      "ApiResponseDto": {
        "type": "object",
        "properties": {
          "success": {
            "type": "boolean"
          },
          "data": {
            "$ref": "#/components/schemas/HealthStatusDto"
          },
          "timestamp": {
            "type": "string",
            "format": "date-time"
          }
        }
      },
      "HealthStatusDto": {
        "type": "object",
        "properties": {
          "status": {
            "type": "string",
            "enum": [
              "ok",
              "degraded",
              "down"
            ]
          },
          "uptime": {
            "type": "number"
          },
          "version": {
            "type": "string"
          }
        }
      }
    }
  }
}